<?xml version="1.0" encoding="utf-8" ?>

<!DOCTYPE students SYSTEM "DTDtest.dtd">

<students>
    <student>
        <first_name></first_name>
        <last_name></last_name>
        <age></age>
        <gendar></gendar>
        <address>
            <city></city>
            <street></street>
            <zip></zip>
        </address>
    </student>
</students>